<?xml version="1.0" encoding="UTF-8"?>
<GameDescriptor xmlns:xsi="http://www.w3.org/2001/XMLSchema-instance" xsi:noNamespaceSchemaLocation="NinaRow.xsd">
	<GameType>Basic</GameType>
	<Game target="4">
		<Board rows="6" columns="7"/>
		<Variant>Regular</Variant>
	</Game>
	<Players>
		<Player id="233">
			<Name>Mushon</Name>
			<Type>Human</Type>
		</Player>
		<Player id="143">
			<Name>Menash</Name>
			<Type>Human</Type>
		</Player>
	<DynamicPlayers game-title="sample game" total-players="3"/>
</GameDescriptor>
